{
  "id": "example.malware_beaconing.generic",
  "type": "malware_beaconing",
  "title": "Possible Periodic Beaconing",
  "severity": "high",
  "description": "Repeated outbound connections with similar timing can indicate command-and-control beaconing.",
  "recommended_action": "Inspect the process, destination reputation, DNS history, and endpoint telemetry.",
  "tags": ["network", "command-and-control"],
  "conditions": {
    "event_type": "network",
    "field_equals": {
      "direction": "outbound"
    },
    "min_count": 8,
    "time_window_seconds": 1800,
    "source_fields": ["source_ip", "destination_ip", "destination_port"]
  }
}

