{
  "id": "example.port_scan.generic",
  "type": "port_scan",
  "title": "Possible Port Scan",
  "severity": "medium",
  "description": "Multiple connection attempts to different destination ports may indicate reconnaissance.",
  "recommended_action": "Review the source, destination assets, and allowed service exposure.",
  "tags": ["network", "reconnaissance"],
  "conditions": {
    "event_type": "network",
    "min_count": 20,
    "time_window_seconds": 300,
    "source_fields": ["source_ip", "destination_ip", "destination_port"]
  }
}

